{"schema_version":"1.0","scenario_id":"f08-economic-abuse-repaired","pair_id":"F08","variant":"repaired","seed":1308,"identity":{"subject_id":"observer-88","role":"observer","authenticated":true,"session_age_minutes":4},"tenant":{"subject_tenant":"north","resource_tenant":"north","requested_tenant":"north"},"request":{"resource_id":"bulk-export","action":"request","required_role":"observer","high_risk":false},"credential":{"expires_after_minutes":60,"revoked":false,"scope":"exports:create","required_scope":"exports:create","exposed_version":1,"active_version":2},"data_lifecycle":{"delete_requested":false,"authoritative":true,"cache":true,"index":true,"backup":true,"audit_tampered":false,"sensitive_logged":false},"dependency":{"name":"export-worker","approved_digest":"sha256:approved","observed_digest":"sha256:approved","provenance_verified":true},"retrieved_content":{"trusted":false,"requests_tool":false,"tool":"none","user_authorized":false,"approval_present":false,"idempotency_key":"none"},"controls":{"tenant_context_binding":true,"object_action_authorization":true,"credential_lifecycle":true,"scoped_secret_rotation":true,"tamper_evident_audit":true,"complete_deletion":true,"dependency_verification":true,"abuse_budget_enforcement":true,"untrusted_content_tool_authorization":true},"expected":{"target_invariant":"I09","repaired_invariants":["I01","I02","I03","I04","I05","I06","I07","I08","I09","I10","I11","I12"]}}
